{
  "$schema": "../../../../../schemas/implementation-slice.schema.json",
  "id": "S02",
  "title": "libero-replace 的送出鍵回到 form 之內，兩個父層持有 open state",
  "capabilities": ["platform/forms", "platform/design-system/overlays"],
  "dependsOn": [],
  "outcome": "libero-replace 的 form 邊界同時包住 DialogBody 與 DialogFooter，送出鍵成為 type=\"submit\"；驗證通過才呼叫 onSuccess，兩個父層各自持有 open state 並據此關閉。那條從未被觸發的 form 送出路徑成為實際執行的路徑。",
  "acceptanceCriteria": [
    "Form 元素同時包住 DialogBody 與 DialogFooter，並帶 min-h-0 flex-1，使 DialogBody 保有可捲動高度。",
    "送出鍵為 type=\"submit\" 且不再被 DialogClose 包住；DialogClose 的 import 一併移除。",
    "LiberoReplaceDialog 收一個 onSuccess prop，在 onSubmit dispatch 之後呼叫。",
    "set-options panel 傳入 onSuccess 關閉自己既有的 liberoDialogOpen state，不新增 state。",
    "lineup panel 改為 controlled Dialog 並傳入 onSuccess，同時把 Dialog 的 import 從 @radix-ui/react-dialog 改回 @/components/ui/dialog。",
    "LiberoReplaceTrigger 與 LiberoReplaceDialog 仍在同一個 Dialog 之下，trigger 在兩個 surface 都能打開 dialog。",
    "在兩個 surface 各自確認 dialog 的捲動與 footer 位置未因 form 邊界改變而跑版。"
  ],
  "verification": [
    "pnpm test -- src/components/game src/components/team",
    "pnpm typecheck",
    "pnpm lint"
  ],
  "status": "pending"
}
