{
  "$schema": "../../../../../schemas/implementation-slice.schema.json",
  "id": "S01",
  "title": "記一顆球的寫入不再就地改動快取物件",
  "capabilities": ["game-recording/rally-recording"],
  "dependsOn": [],
  "outcome": "`createRallyHelper` 與 `updateRallyHelper` 成為純函式，回傳新的 `GameView` 而不改動傳進來的那個；`oppo.tsx` 改用 `mutate` 的函式形式取得未合併的快取。行為完全不變——函式參數現在拿到的就是 raw cache，寫進去的內容與改動前相同——但「寫入只碰 raw」這條路從此存在，S03 才能只做合併一件事。",
  "acceptanceCriteria": [
    "`rally.helper.ts` 的兩個 helper 不再對參數執行 `set.entries[entryIndex] = ...`、`set.win = ...` 或 `game.win = ...`，改為回傳新的 `GameView`；傳進去的物件在呼叫前後深度相等。",
    "phase 的推導與套用分成兩個匯出：一個從 `GameView` 算出 `SetPhase`，一個把 entry 與 phase 套用成新的 `GameView`。推導不寫入，套用不推導。",
    "`useSubmitEntryDraft` 的 `create` 與 `update` 都改為 `mutate((raw) => ..., { revalidate: false })`；phase 仍同步取得，`dispatch(confirmEntryDraftRally(phase))` 不等待任何 promise。",
    "`update` 路徑「entry 不是 rally 就拋錯」的既有行為保留。",
    "局結果的推導內容一行不改——as-of `entryIndex` 判定、以 `entryDraft` 的比分決定 `set.win`，全部照舊。與伺服器 `deriveSetCompletion` 對齊是另一張 Change 的事。",
    "`usePendingWrites` 的 `runFlush` 與 `useUnconfirmedSetCompletion` 的 `retry` 不修改：兩者本來就是函式形式。"
  ],
  "verification": [
    "pnpm test",
    "pnpm typecheck:strict",
    "pnpm lint",
    "pnpm format:check"
  ],
  "status": "pending"
}
