{
  "$schema": "../../../../../schemas/implementation-slice.schema.json",
  "id": "S03",
  "title": "移除 set-options 送出流程中到不了的 libero dialog 關閉",
  "capabilities": ["platform/design-system/overlays"],
  "dependsOn": ["S02"],
  "outcome": "set-options panel 自己的 onSubmit 不再包含一行永遠執行不到的 setLiberoDialogOpen(false)，liberoDialogOpen 的唯一寫入來源是 Dialog 的 onOpenChange 與 S02 的 onSuccess。",
  "acceptanceCriteria": [
    "移除 Options 的 onSubmit 內的 setLiberoDialogOpen(false)。",
    "刪除理由記錄在提交訊息中：libero dialog 是 modal 且渲染 overlay，全 repo 未曾傳入 modal prop，Radix 預設為 true，因此該 dialog 開啟時 panel 的送出鍵既無法點擊也無法以鍵盤到達。",
    "liberoDialogOpen 仍由 Dialog 的 onOpenChange 與 S02 的 onSuccess 正確維護，set-options 的送出流程行為不變。"
  ],
  "verification": [
    "pnpm test -- src/components/game",
    "pnpm typecheck",
    "pnpm lint"
  ],
  "status": "pending"
}
